{
  "protocolVersion": "1.6.0",
  "requestId": "REQ_LAYER_CONTROLS_VALID",
  "transactionId": "TX_LAYER_CONTROLS_VALID",
  "operationId": "OP_LAYER_CONTROLS_VALID",
  "capabilityId": "ae.layer.switches.set",
  "command": "layer.switches.set",
  "expectedHostProjectRevision": 42,
  "payload": {
    "comp": {"stableId": "COMP_MAIN"},
    "layer": {"stableId": "LAYER_HERO"},
    "switches": {
      "enabled": true,
      "solo": false,
      "shy": false,
      "effectsActive": true,
      "quality": "BEST",
      "samplingQuality": "BICUBIC"
    }
  },
  "readbackProfile": "M3_LAYER_CONTROLS_STRUCTURAL"
}
